{"analysis":{"ignored_directories":[".cache",".git",".hg",".mypy_cache",".next",".nuxt",".pytest_cache",".svn",".tmp",".tox",".venv","__MACOSX","__pycache__","bower_components","build","cache","coverage","dist","node_modules","out","temp","tmp","vendor","venv"],"languages":["c","cpp","csharp","go","java","javascript","php","python","rust","typescript"],"max_file_bytes":1048576},"analysis_run_id":"01k6p0a1b2c3d4e5f6g7h8j9km","contract_version":"1.0","diagnostics":{"duration_ms":20,"replayed":false},"ir":{"files":[{"extension":".md","language":null,"lines":null,"path":"README.md","size_bytes":10,"skip_reason":"unsupported_language"},{"extension":".php","language":"php","lines":12,"path":"src/Café.php","size_bytes":223,"skip_reason":null},{"extension":".js","language":"javascript","lines":1,"path":"src/broken.js","size_bytes":11,"skip_reason":null},{"extension":".py","language":"python","lines":7,"path":"src/util.py","size_bytes":112,"skip_reason":null}],"version":"1.0"},"languages":[{"bytes":11,"files":1,"language":"javascript","lines":1},{"bytes":223,"files":1,"language":"php","lines":12},{"bytes":112,"files":1,"language":"python","lines":7}],"request_id":"a074340e-50ec-40d2-b897-79e4851c55d0","result_hash":"3635a0836b86c8170b8d3a41e728ec89ad3c65649515fe4ea6cd63debcbb964a","result_type":"foundation","source":{"bytes_total":356,"files_analyzed":3,"files_skipped":{"binary":0,"ignored_path":0,"too_large":0,"unsupported_language":1},"files_total":4,"sha256":"0a4a75e9950d1ac3c656206501b572135fa0cf1606ba5be38b38b44a0fd53065","size_bytes":695},"versions":{"analyzer":"0.2.0","ir":"1.0","metrics":null,"parsers":{},"scoring":null}}